{
  "schema_version": "1.1",
  "name": "mmdash-default-article",
  "version": "1.1.0",
  "entrypoint": "main.tex",
  "output": "paper.pdf",
  "content_target": "sections/generated-content.tex",
  "bibliography_target": "references.bib",
  "engine": "auto",
  "bibliography_tool": "auto",
  "abstract_target": "generated-abstract-block.tex",
  "body_layout": "single",
  "field_profile": "default",
  "figure_dir": "figures",
  "bibliography_mode": "inline"
}
